CODIGO_SISTEMA,MUNICIPIO,PERSONA_PRESTADORA,SISTEMA_DISTRIBUCION,CLASIFICACION_URBANO_RURAL,ARO,TIPO_SISTEMA,TIPO_DISPOSITIVO_AJUSTADO,LATITUD,LONGITUD,MUESTRAS,ANIOS,IRCA_PROMEDIO,IRCA_MAXIMO,NIVEL_RIESGO,VALIDACION_SISTEMA,PARAMETROS_NO_ACEPTABLES,TOTAL_NO_ACEPTABLES
124278,DAGUA,ASOCIACION DE SUSCRIPTORES DEL ACUEDUCTO LA SUIZA - PARCELACION LA SUIZA,LA SUIZA,Rural,Sur Cali,DISPERSA,Grifo,3.564031,-76.717,9,"2020, 2022, 2023, 2024, 2025, 2026",53.69444444444444,86.52,INVIABLE SANITARIAMENTE,EXISTENTE,5,29
35014,DAGUA,EMPRESA COMUNITARIA ACUEDUCTO RURAL EL PALMAR - ECOAREPAL - LA VIBORA | EMPRESA COMUNITARIA ACUEDUCTO RURAL EL PALMAR - ECOAREPAL - LA VIRGEN,LA VIBORA,Rural,Sur Cali,CENTRO POBLADO,Grifo,3.599694,-76.64625,24,"2020, 2021, 2022, 2023, 2024, 2025, 2026",3.046666666666667,24.56,MEDIO,EXISTENTE,2,8
113450,DAGUA,EMPRESA COMUNITARIA ACUEDUCTO RURAL EL PALMAR - ECOAREPAL - LA VIRGEN,LA VIRGEN,Rural,Sur Cali,CENTRO POBLADO,Grifo,3.603083,-76.64647,22,"2020, 2021, 2022, 2023, 2024, 2025, 2026",6.491363636363636,86.61,INVIABLE SANITARIAMENTE,EXISTENTE,5,10
38277,DAGUA,ASOCIACIÓN DE SUSCRIPTORES DEL SERVICIO DE AGUA POTABLE DE LAS CAMELIAS Y EMPRESA COMUNITARIA DE SERVICIOS PÚBLICOS.,LAS CAMELIAS,Rural,Sur Cali,CENTRO POBLADO,Grifo,3.546564,-76.71467,18,"2020, 2021, 2022, 2023, 2024, 2025, 2026",40.18,87.5,INVIABLE SANITARIAMENTE,EXISTENTE,7,42
119865,DAGUA,ASOCIACIÓN DE USUARIOS DEL SERVICIO DE AGUA POTABLE DEL LIMONAR MUNICIPIO DE DAGUA,LIMONAR,Rural,Sur Cali,CENTRO POBLADO,Grifo,3.608703,-76.71041,1,2022,66.19,66.19,ALTO,EXISTENTE,3,4
44630,DAGUA,ASOCIACION DE USUARIOS ACUEDUCTO LOBOGUERRERO,LOBOGUERRERO,Rural,Sur Cali,CENTRO POBLADO,Grifo / Filtro,3.761389,-76.66592,29,"2020, 2021, 2022, 2023, 2024, 2025",23.05551724137931,87.77,INVIABLE SANITARIAMENTE,EXISTENTE,5,51
101957,DAGUA,"ASOCIACION DE USUARIOS DEL ACUEDUCTO QUEBRADA LOS CHORROS, CORREGIMIENTO ATUNCELA, MUNICIPIO DE DAGUA - ASUACAT",LOS CHORROS,Rural,Sur Cali,CENTRO POBLADO,Grifo / Filtro,3.737167,-76.67894,8,"2020, 2021, 2022, 2024, 2025",60.144999999999996,89.05,INVIABLE SANITARIAMENTE,EXISTENTE,5,27
103022,DAGUA,ASOCIACION DE USUARIOS DEL ACUEDUCTO RURAL COLECTIVO DE LA VEREDA DE MACHADO,MACHADO,Rural,Sur Cali,DISPERSA,Grifo,3.534972,-76.69569,12,"2020, 2021, 2022, 2023, 2024, 2025, 2026",21.959166666666665,89.05,INVIABLE SANITARIAMENTE,EXISTENTE,4,16
124277,DAGUA,ASOCIACION DE PROPIETARIOS PARCELACION MONTERRICO,MONTERRICO,Rural,Sur Cali,DISPERSA,Grifo,3.537778,-76.61333,6,"2020, 2022, 2023, 2024, 2025",83.885,94.57,INVIABLE SANITARIAMENTE,EXISTENTE,5,33
128093,DAGUA,ASOCIACIÓN DE USUARIOS DE ACUEDUCTO EL PALMARCITO DE LA VEREDA LA VIRGEN,PALMARCITO,Rural,Sur Cali,CENTRO POBLADO,Grifo,3.603417,-76.63022,17,"2020, 2021, 2022, 2023, 2024, 2025, 2026",35.92588235294118,88.0,INVIABLE SANITARIAMENTE,EXISTENTE,5,40
128439,DAGUA,JUNTA ADMINISTRADORA ACUEDUCTO PARAGUITAS JAACUPAR,PARAGUITAS,Rural,Sur Cali,DISPERSA,Grifo,3.518831,-76.66646,13,"2020, 2022, 2023, 2024, 2025",62.37461538461538,94.57,INVIABLE SANITARIAMENTE,EXISTENTE,5,49
109610,DAGUA,"JUNTA ADMINISTRADORA DE ACUEDUCTO PEÑAS RUCIAS VEREDA EL JORDANCITO, SAN BERNARDO. DAGUA - VALLE",PEÑAS RUCIAS,Rural,Sur Cali,DISPERSA,Grifo,3.502611,-76.66528,15,"2020, 2021, 2022, 2023, 2024, 2025, 2026",3.275333333333333,24.0,MEDIO,EXISTENTE,3,4
111037,DAGUA,ASOCIACIÓN DE USUARIOS DEL SERVICIO DE AGUA POTABLE Y ALCANTARILLADO DE LA VEREDA EL CHILCAL,PTAP EL CHILCAL,Rural,Sur Cali,CENTRO POBLADO,Grifo,3.583917,-76.70906,20,"2020, 2021, 2022, 2023, 2024, 2025, 2026",36.2695,94.57,INVIABLE SANITARIAMENTE,EXISTENTE,6,51
45411,DAGUA,ASOCIACION DE USUARIOS DEL ACUEDUCTO VEREDAL LA ROSITA E.S.P. - ASOACUEDUCTO,PTAP LA ROSITA,Rural,Sur Cali,DISPERSA,Grifo,3.541417,-76.68042,12,"2020, 2021, 2022, 2023, 2024, 2025, 2026",6.595,79.14,ALTO,EXISTENTE,3,5
35015,DAGUA,ASOCIACION DE USUARIOS DEL SERVICIO DE AGUA POTABLE Y ALCANTARILLADO DEL ACUEDUCTO SAN VICENTE KM. 95 - LAS CAMELIAS | ASOCIACION DE USUARIOS DEL SERVICIO DE AGUA POTABLE Y ALCANTARILLADO DEL ACUEDUCTO SAN VICENTE KM. 95 - SAN VICENTE,PTAP LAS CAMELIAS KM 95 | PTAP SAN VICENTE,Rural,Sur Cali,DISPERSA,Grifo,3.643667,-76.66981,25,"2020, 2021, 2022, 2023, 2024, 2025, 2026",53.107600000000005,87.77,INVIABLE SANITARIAMENTE,EXISTENTE,5,74
34207,DAGUA,ACUEDUCTO COMUNITARIO SAN BERNARDO,PTAP SAN BERNARDO,Rural,Sur Cali,CENTRO POBLADO,Grifo,3.48925,-76.65117,12,"2020, 2021, 2022, 2023, 2024, 2025",25.551666666666666,89.05,INVIABLE SANITARIAMENTE,EXISTENTE,4,23
41031,DAGUA,ASOCIACIÓN DE USUARIOS DE ACUEDUCTO Y SERVICIOS BÁSICOS DE LA VEREDA PUEBLO NUEVO CORREGIMIENTO BORRERO AYERBE DEL MUNICIPIO DE DAGUA VALLE,PUEBLO NUEVO-DAGUA,Rural,Sur Cali,CENTRO POBLADO,Grifo,3.582111,-76.62811,23,"2020, 2021, 2022, 2023, 2024, 2025, 2026",8.190434782608696,32.56,MEDIO,EXISTENTE,3,20
117137,DAGUA,ASOCIACION DE USUARIOS ACUEDUCTO PUERTA DAGUA RIO DAGUA E.S.P EN LIQUIDACION,PUERTA DAGUA,Rural,Sur Cali,DISPERSA,Grifo,3.719861,-76.67075,15,"2020, 2021, 2022, 2023, 2024, 2025",70.66733333333333,88.89,INVIABLE SANITARIAMENTE,EXISTENTE,5,57
45410,DAGUA,"ASOCIACION DE USUARIOS, ACUEDUCTO SAN JOSE DEL SALADO PARTE ALTA - ASUSAL",SALADO PARTE ALTA,Rural,Sur Cali,CENTRO POBLADO,Grifo,3.555139,-76.71741,13,"2020, 2021, 2022, 2023, 2024, 2025, 2026",73.82615384615384,94.57,INVIABLE SANITARIAMENTE,EXISTENTE,5,59
12977,DAGUA,PARCELACION SAN FERNANDO | ASOCIACION ACUEDUCTO RURAL LA VIRGINIA,SAN FERNANDO | LA VIRGINIA,Rural,Sur Cali,DISPERSA,Grifo,,,4,"2020, 2023, 2024, 2025",0.0,0.0,SIN RIESGO,VALIDAR SISTEMA,0,0
102666,DAGUA,ASOCIACION DE SUSCRIPTORES DEL SERVICIO DE ACUEDUCTO SAN JOAQUIN CORREGIMIENTO SAN VICENTE DAGUA,SAN JOAQUIN,Rural,Sur Cali,DISPERSA,Grifo / Filtro,3.658167,-76.67957,10,"2022, 2023, 2024, 2025, 2026",19.199,88.0,INVIABLE SANITARIAMENTE,EXISTENTE,4,13
34214,DAGUA,ASOCIACION COMUNITARIA ADMINISTRADORA DEL ACUEDUCTO DE SAN MIGUEL - ACUAMIGUEL,SAN MIGUEL,Rural,Sur Cali,DISPERSA,Grifo,3.522972,-76.62981,17,"2020, 2021, 2022, 2023, 2024, 2025, 2026",5.73235294117647,65.71,ALTO,EXISTENTE,5,7
50555,DAGUA,ASOCIACION DE SUSCRIPTORES DEL SERVICIO DE ACUEDUCTO SAN VICENTE,SAN VICENTE,Rural,Sur Cali,CENTRO POBLADO,Grifo / Filtro,3.655803,-76.67748,11,"2022, 2023, 2024, 2025, 2026",36.38454545454545,88.0,INVIABLE SANITARIAMENTE,EXISTENTE,4,25
33542,DAGUA,ASOCIACION COMUNITARIA ADMINISTRADORA DEL ACUEDUCTO DE LA LOCALIDAD DE SANTA MARIA MUNICIPIO DE DAGUA - ACOACEDRO,SANTA MARIA PARTE ALTA,Rural,Sur Cali,CENTRO POBLADO,Grifo,3.630694,-76.72069,14,"2020, 2021, 2022, 2023, 2024, 2025, 2026",61.54571428571428,85.27,INVIABLE SANITARIAMENTE,EXISTENTE,4,45
38184,DAGUA,ASOCIACION ACUEDUCTO RURAL COMUNITARIO SENDO - TIGRE - AACTISE,SENDO TIGRE,Rural,Sur Cali,DISPERSA,Grifo,3.533694,-76.69569,15,"2020, 2021, 2022, 2023, 2024, 2025",22.456666666666667,80.29,INVIABLE SANITARIAMENTE,EXISTENTE,4,25
34208,DAGUA,ASOCIACION DE USUARIOS DE ACUEDUCTO DE LA VEREDA TOCOTA - ASOTOCOTA,TOCOTA,Rural,Sur Cali,CENTRO POBLADO,Grifo,3.507444,-76.648,19,"2020, 2021, 2022, 2023, 2024, 2025, 2026",5.288947368421052,52.55,ALTO,EXISTENTE,4,12
112959,DAGUA,ASOCIACION DE USUARIOS DEL SERVICIO DE ACUEDUCTO EL TRAPICHE LA YOLOMBA,TRAPICHE,Rural,Sur Cali,DISPERSA,Grifo / Filtro,3.778167,-76.64664,15,"2020, 2021, 2022, 2023, 2024, 2025",78.93933333333332,90.91,INVIABLE SANITARIAMENTE,EXISTENTE,5,70
34630,DAGUA,ASOCIACION DE USUARIOS DEL ACUEDUCTO RURAL VILLAHERMOSA - ACUEHERMOSA,VILLAHERMOSA,Rural,Sur Cali,DISPERSA,Grifo,3.736944,-76.67531,13,"2020, 2021, 2022, 2023, 2024, 2025, 2026",9.55076923076923,24.85,MEDIO,EXISTENTE,2,13
86233,EL AGUILA,SOCIEDAD DE ACUEDUCTOS Y ALCANTARILLADOS DEL VALLE DEL CAUCA S.A. E.S.P. ACUAVALLE S.A. E.S.P.-EL ÁGUILA,ACUAVALLE S.A. E.S.P- EL AGUILA,Urbano,Norte Cartago,CABECERA MUNICIPAL,Grifo,4.911111,-76.04084,74,"2020, 2021, 2022, 2023, 2024, 2025, 2026",0.21405405405405406,7.1,BAJO,EXISTENTE,4,9
148293,EL AGUILA,"JUNTA ADMINISTRADORA DEL ACUEDUCTO RURAL LA JUDEA ALTA, LA PALMERA Y EL BRILLANTE",ACUEDUCTO RURAL LA JUDEA 2 -EL BRILLANTE,Rural,Norte Cartago,DISPERSA,Grifo / Filtro,4.952156,-76.0642,9,"2022, 2023, 2024, 2025",48.50111111111111,85.27,INVIABLE SANITARIAMENTE,EXISTENTE,4,27
128788,EL AGUILA,ACUEDUCTO RURAL VEREDA LA ALBANIA,ACUEDUCTO RURAL VEREDA LA ALBANIA,Rural,Norte Cartago,DISPERSA,Grifo,4.858314,-76.08634,13,"2020, 2021, 2022, 2023, 2024, 2025, 2026",64.19384615384615,87.86,INVIABLE SANITARIAMENTE,EXISTENTE,5,45
109476,EL AGUILA,EMPRESA COMUNAL SOLIDARIA SANTA CLARA DE LOS ACUEDUCTOS 1 Y 2 - LLANO GRANDE # 1,ACUEDUCTO SON LUIS LLANO GRANDE # 1,Rural,Norte Cartago,DISPERSA,Grifo,4.906111,-76.05583,17,"2020, 2021, 2022, 2023, 2024, 2025, 2026",72.76764705882353,89.94,INVIABLE SANITARIAMENTE,EXISTENTE,5,71
91664,EL AGUILA,ASOCIACION DE USUARIOS DEL ACUEDUCTO DE LA CEDALIA,ASOCIACION DE USUARIOS DEL ACUEDUCTO DE LA CEDALIA,Rural,Norte Cartago,DISPERSA,Grifo,4.874994,-76.09979,13,"2020, 2021, 2022, 2023, 2024, 2025, 2026",60.24461538461538,87.86,INVIABLE SANITARIAMENTE,EXISTENTE,6,49
86226,EL AGUILA,ASOCIACION DE USUARIOS DEL ACUEDUCTO DE LA LIBERTAD CATARINA,ASOCIACION DE USUARIOS DEL ACUEDUCTO DE LA LIBERTAD CATARINA,Rural,Norte Cartago,DISPERSA,Grifo,4.854022,-76.02068,16,"2020, 2021, 2022, 2023, 2024, 2025, 2026",76.31875,94.57,INVIABLE SANITARIAMENTE,EXISTENTE,5,74
80376,EL AGUILA,JUNTA ADMINISTRADORA DEL ACUEDUCTO SANTA MARTHA,ASOCIACION DE USUARIOS DEL ACUEDUCTO RURAL COMUNITARIO DE VEREDA SANTA MARTA,Rural,Norte Cartago,DISPERSA,Grifo,0,,15,"2020, 2021, 2022, 2023, 2024, 2025",59.68066666666667,85.27,INVIABLE SANITARIAMENTE,EXISTENTE,5,52
80781,EL AGUILA,ASOCIACION DE USUARIOS DEL ACUEDUCTO RURAL COMUNITARIO DEL CORREGIMIENTO LA MARIA,ASOCIACION DE USUARIOS DEL ACUEDUCTO RURAL COMUNITARIO DEL CORREGIMIENTO LA MARIA,Rural,Norte Cartago,CENTRO POBLADO,Grifo,4.869781,-76.08116,17,"2020, 2021, 2022, 2023, 2024, 2025, 2026",35.37,80.81,INVIABLE SANITARIAMENTE,EXISTENTE,4,35
88332,EL AGUILA,ASOCIACION DE USUARIOS DEL ACUEDUCTO RURAL COMUNITARIO DEL CORREGIMIENTO QUIEBRA DE SAN PABLO,ASOCIACION DE USUARIOS DEL ACUEDUCTO RURAL COMUNITARIO DEL CORREGIMIENTO QUIEBRA DE SAN PABLO,Rural,Norte Cartago,CENTRO POBLADO,Grifo,4.860267,-76.06031,18,"2020, 2021, 2022, 2023, 2024, 2025, 2026",69.91166666666668,94.57,INVIABLE SANITARIAMENTE,EXISTENTE,6,74
86214,EL AGUILA,ASOCIACION DE USUARIOS DEL ACUEDUCTO SANTA RITA VILLANUEVA,ASOCIACION DE USUARIOS DEL ACUEDUCTO SANTA RITA VILLANUEVA,Rural,Norte Cartago,CENTRO POBLADO,Grifo / Filtro,4.969869,-76.03749,11,"2020, 2021, 2022, 2023, 2024, 2025, 2026",22.670909090909092,82.47,INVIABLE SANITARIAMENTE,EXISTENTE,6,20
81607,EL AGUILA,ASOCIACION DE USUARIOS DEL ACUEDUCTO COLECTIVO (COSTA),ASOCIACION DE USUARIOS VEREDA EL COFRE Y SAN JOSE,Rural,Norte Cartago,CENTRO POBLADO,Grifo / Filtro,4.518231,-76.14246,13,"2020, 2021, 2022, 2023, 2024, 2025",35.41384615384615,89.29,INVIABLE SANITARIAMENTE,EXISTENTE,5,24
144306,EL AGUILA,ASOCIACIÓN DE USUARIOS ACUEDUCTO EL NARANJO,ASOCIACIÓN DE USUARIOS ACUEDUCTO RURAL EL NARANJO,Rural,Norte Cartago,DISPERSA,Grifo,4.928961,-76.03155,6,"2021, 2022, 2024, 2025, 2026",60.53666666666667,78.01,ALTO,EXISTENTE,3,18
109329,EL AGUILA,ASOCIACIÓN DE USUARIOS DE ACUEDUCTO EL PITAL,ASOCIACIÓN DE USUARIOS DE ACUEDUCTO EL PITAL,Rural,Norte Cartago,DISPERSA,Grifo,4.872006,-76.0684,5,"2021, 2022, 2023",86.89,89.05,INVIABLE SANITARIAMENTE,EXISTENTE,4,27
80785,EL AGUILA,ASOCIACIÓN DE USUARIOS DEL ACUEDUCTO CAÑAVERAL,ASOCIACIÓN DE USUARIOS DEL ACUEDUCTO CAÑAVERAL,Rural,Norte Cartago,CENTRO POBLADO,Grifo,4.984017,-76.04294,10,"2020, 2021, 2022, 2023, 2024, 2025, 2026",68.553,82.71,INVIABLE SANITARIAMENTE,EXISTENTE,5,37
103590,EL AGUILA,ASOCIACIÓN DE USUARIOS DEL ACUEDUCTO EL CORAZON,ASOCIACIÓN DE USUARIOS DEL ACUEDUCTO EL CORAZON,Rural,Norte Cartago,DISPERSA,Grifo,4.878286,-76.07258,4,"2020, 2021, 2022, 2025",80.8475,91.73,INVIABLE SANITARIAMENTE,EXISTENTE,5,18
125032,EL AGUILA,JUNTA ADMINISTRADORA ACUEDUCTO LA ESTRELLA,JUNTA ADMINISTRADORA ACUEDUCTO LA ESTRELLA,Rural,Norte Cartago,DISPERSA,Grifo,4.938417,-76.06234,1,2020,63.58,63.58,ALTO,EXISTENTE,3,4
87088,EL AGUILA,JUNTA ADMINISTRADORA DEL ACUEDUCTO DE ESPARTA,JUNTA ADMINISTRADORA DEL ACUEDUCTO DE ESPARTA,Rural,Norte Cartago,CENTRO POBLADO,Grifo,4.912053,-75.98893,9,"2020, 2021, 2022, 2023, 2024, 2025, 2026",67.08444444444444,91.24,INVIABLE SANITARIAMENTE,EXISTENTE,6,33
81605,EL AGUILA,JUNTA ADMINISTRADORA DEL AGUA VEREDA LA GUERRA,JUNTA ADMINISTRADORA DEL AGUA VEREDA LA GUERRA,Rural,Norte Cartago,DISPERSA,Grifo,4.920264,-76.02971,12,"2020, 2021, 2022, 2023, 2024, 2025",58.865,85.27,INVIABLE SANITARIAMENTE,EXISTENTE,4,41
86223,EL AGUILA,JUNTA ADMINISTRADORA  EMBAL,JUNTA ADMINISTRADORA EL EMBAL,Rural,Norte Cartago,DISPERSA,Grifo,4.860767,-76.11458,3,"2024, 2025, 2026",68.95333333333333,91.73,INVIABLE SANITARIAMENTE,EXISTENTE,4,12
111723,EL AGUILA,ASOCIACION MUNICIPAL DE ACUEDUCTOS RURALES AGUA Y VIDA - LA LINEA,JUNTA ADMINISTRADORA VEREDA LA LINEA,Rural,Norte Cartago,DISPERSA,Grifo,4.887383,-76.06308,15,"2020, 2021, 2022, 2023, 2024, 2025, 2026",62.12066666666667,91.73,INVIABLE SANITARIAMENTE,EXISTENTE,6,56
147215,EL AGUILA,JUNTA DE ACCION COMUNAL LLANO GRANDE  ACUEDUCTO SANTA CLARA 2,JUNTA DE ACCION COMUNAL LLANO GRANDE ACUEDUCTO SANTA CLARA 2,Rural,Norte Cartago,DISPERSA,Grifo,4.915608,-76.06359,8,"2022, 2023, 2024, 2025, 2026",59.2125,87.77,INVIABLE SANITARIAMENTE,EXISTENTE,4,28
99375,EL AGUILA,JUNTA DE ACCION COMUNAL VEREDA EL GUAYABO-SAN LUIS-EL SALADA,JUNTA DE ACCION COMUNAL VEREDA EL GUAYABO,Rural,Norte Cartago,CENTRO POBLADO,Grifo,,,14,"2020, 2021, 2022, 2023, 2024, 2025, 2026",71.9042857142857,89.29,INVIABLE SANITARIAMENTE,EXISTENTE,6,63
81103,EL AGUILA,JUNTA DE ACUEDUCTO LA JUDEA,JUNTA DE ACUEDUCTO LA JUDEA,Rural,Norte Cartago,DISPERSA,Grifo / Filtro,4.955492,-76.06062,12,"2020, 2021, 2022, 2023, 2024, 2025",56.04583333333334,89.29,INVIABLE SANITARIAMENTE,EXISTENTE,6,42
117582,EL AGUILA,ACUEDUCTO RURAL SANTA ELENA,SANTA ELENA BAJO,Rural,Norte Cartago,DISPERSA,Grifo,4.926389,-76.05778,2,"2022, 2025",71.275,86.61,INVIABLE SANITARIAMENTE,EXISTENTE,3,8
81273,EL CAIRO,SOCIEDAD DE ACUEDUCTOS Y ALCANTARILLADOS DEL VALLE DEL CAUCA S.A. E.S.P. ACUAVALLE S.A. E.S.P. - EL CAIRO,ACUAVALLE S.A. E.S.P- EL CAIRO,Urbano,Norte Cartago,CABECERA MUNICIPAL,Grifo,4.756722,-76.22367,73,"2020, 2021, 2022, 2023, 2024, 2025, 2026",0.3110958904109589,7.55,BAJO,EXISTENTE,4,15
80062,EL CAIRO,ASOCIACION COMUNITARIA ADMINISTRADORA DEL ACUEDUCTO DE LA VEREDA DE LLANOGRANDE,ACUEDUCTO DE LA VEREDA DE LLANOGRANDE,Rural,Norte Cartago,DISPERSA,Grifo,4.749567,-76.21744,16,"2020, 2021, 2022, 2023, 2024, 2025",69.2425,86.52,INVIABLE SANITARIAMENTE,EXISTENTE,5,63
86230,EL CAIRO,ASOCIACION DE USUARIOS DEL ACUEDUCTO RURAL COMUNITARIO DE LAS VEREDAS LA ESTRELLA LUNA PARK,ACUEDUCTO RURAL COMUNITARIO DE LAS VEREDAS LA ESTRELLA,Rural,Norte Cartago,DISPERSA,Grifo / Filtro,4.776333,-76.19888,16,"2020, 2021, 2022, 2023, 2024, 2025, 2026",64.495625,94.57,INVIABLE SANITARIAMENTE,EXISTENTE,7,58
114537,EL CAIRO,ASOCIACION DE USUARIOS ACUEDUCTO  SALMELIA,ACUEDUCTO RURAL CORREGIMIENTO LA SALMELIA,Rural,Norte Cartago,DISPERSA,Grifo,4.738394,-76.17342,10,"2020, 2021, 2022, 2023, 2024, 2025",74.991,88.89,INVIABLE SANITARIAMENTE,EXISTENTE,5,46
145147,EL CAIRO,ACUEDUCTO RURAL EL DIAMANTE,ACUEDUCTO RURAL EL DIAMANTE,Rural,Norte Cartago,DISPERSA,Grifo,4.795122,-76.15564,11,"2022, 2023, 2024, 2025, 2026",81.97181818181818,91.73,INVIABLE SANITARIAMENTE,EXISTENTE,5,57
103062,EL CAIRO,USUARIOS DEL ACUEDUCTO RURAL EL JARDÍN-GUADUALITO,ACUEDUCTO RURAL EL JARDÍN-GUADUALITO,Rural,Norte Cartago,DISPERSA,Grifo,,,1,2021,80.81,80.81,INVIABLE SANITARIAMENTE,EXISTENTE,2,3
109646,EL CAIRO,ACUEDUCTO RURAL LA CARBONERA,ACUEDUCTO RURAL LA CARBONERA,Rural,Norte Cartago,DISPERSA,Grifo,4.775011,-76.15863,14,"2020, 2021, 2022, 2023, 2024, 2025, 2026",62.33428571428572,85.31,INVIABLE SANITARIAMENTE,EXISTENTE,6,56
87885,EL CAIRO,JUNTA ADMINISTRADORA  ACUEDUCTO RURAL LA PALMERA,ACUEDUCTO RURAL LA PALMERA,Rural,Norte Cartago,DISPERSA,Grifo,4.731694,-76.22921,7,"2020, 2021, 2022, 2023, 2024, 2025, 2026",66.71142857142857,80.81,INVIABLE SANITARIAMENTE,EXISTENTE,5,25
12562,EL CAIRO,ACUEDUCTO RURAL LA RIVERA-VEREDAS EL BRILLANTE-LA LAGUNA,ACUEDUCTO RURAL LA RIVERA-VEREDAS EL BRILLANTE-LA LAGUNA,Rural,Norte Cartago,DISPERSA,Grifo,,,1,2021,80.81,80.81,INVIABLE SANITARIAMENTE,VALIDAR SISTEMA,2,3
12770,EL CAIRO,ACUEDUCTO RURAL LA SIBERIA,ACUEDUCTO RURAL LA SIBERIA,Rural,Norte Cartago,DISPERSA,Grifo,,,3,"2024, 2025",60.68,64.34,ALTO,VALIDAR SISTEMA,3,10
114645,EL CAIRO,ACUEDUCTO RURAL SAN JOSE #1,ACUEDUCTO RURAL SAN JOSE #1,Rural,Norte Cartago,DISPERSA,Grifo / Filtro,,,13,"2020, 2021, 2022, 2023, 2024, 2025",54.07846153846154,85.11,INVIABLE SANITARIAMENTE,VALIDAR SISTEMA,5,39
86228,EL CAIRO,ACUEDUCTO RURAL SAN JOSE #2,ACUEDUCTO RURAL SAN JOSE #2,Rural,Norte Cartago,DISPERSA,Grifo,4.736472,-76.25615,12,"2020, 2021, 2022, 2023, 2024, 2025",75.60166666666667,89.05,INVIABLE SANITARIAMENTE,EXISTENTE,6,54
86229,EL CAIRO,ASOCIACIÓN DE USUARIOS DEL ACUEDUCTO RURAL COMUNITARIO DEL CORREGIMIENTO ALBAN,ALBAN,Rural,Norte Cartago,CENTRO POBLADO,Grifo,4.782008,-76.17213,19,"2020, 2021, 2022, 2023, 2024, 2025, 2026",23.234736842105264,93.98,INVIABLE SANITARIAMENTE,EXISTENTE,6,36
80742,EL CAIRO,JUNTA ADMINISTRADORA ACUEDUCTO RURAL LA GUARDIA,ASOCIACIÓN DE USUARIOS DEL ACUEDUCTO LA GUARDIA,Rural,Norte Cartago,DISPERSA,Grifo / Filtro,4.710411,-76.19399,12,"2020, 2021, 2022, 2023, 2024, 2025, 2026",60.79750000000001,89.05,INVIABLE SANITARIAMENTE,EXISTENTE,7,42
91656,EL CAIRO,ASOCIACION DE USUARIOS DEL ACUEDUCTO RURAL COMUNITARIO DE LAS VEREDAS LA MIRANDA Y LA GUARDIA MUNICIPIO DE EL CAIRO,ASOCIACIÓN DE USUARIOS DEL ACUEDUCTO RURAL COMUNITARIO DE LAS VEREDAS LA MIRANDA Y LA GUARDIA,Rural,Norte Cartago,DISPERSA,Grifo / Filtro,4.718703,-76.19451,11,"2020, 2022, 2023, 2024, 2025, 2026",67.66727272727273,94.57,INVIABLE SANITARIAMENTE,EXISTENTE,5,47
12561,EL CAIRO,ASOCIACIÓN DE USUARIOS DEL ACUEDUCTO RURAL COMUNITARIO DEL CORREGIMIENTO ALBAN,ASOCIACIÓN DE USUARIOS DEL ACUEDUCTO RURAL VEREDA LA MIRANDA,Rural,Norte Cartago,DISPERSA,Grifo,4.782008,-76.17213,1,2021,80.81,80.81,INVIABLE SANITARIAMENTE,EXISTENTE,2,3
12560,EL CAIRO,JUNTA ADMINISTRADORA  ACUEDUCTO CAMELLONES,JUNTA ADMINISTRADORA  ACUEDUCTO CAMELLONES ALTO | JUNTA ADMINISTRADORA ACUEDUCTO CAMELLONES ALTO,Rural,Norte Cartago,DISPERSA,Grifo,4.729806,-76.19875,12,"2020, 2021, 2022, 2023, 2024, 2025, 2026",60.25833333333333,82.71,INVIABLE SANITARIAMENTE,EXISTENTE,4,48
80740,EL CAIRO,JUNTA ADMINISTRADORA  ACUEDUCTO CAMELLONES,JUNTA ADMINISTRADORA ACUEDUCTO CAMELLONES BAJO,Rural,Norte Cartago,DISPERSA,Grifo,4.725494,-76.20714,12,"2020, 2021, 2022, 2023, 2024, 2025, 2026",69.23666666666666,82.48,INVIABLE SANITARIAMENTE,EXISTENTE,6,47
91939,EL CAIRO,JUNTA ADMINISTRADORA DEL ACUEDUCTO DEL PACIFICO,JUNTA ADMINISTRADORA DEL ACUEDUCTO EL PACIFICO,Rural,Norte Cartago,DISPERSA,Grifo,4.812511,-76.16945,5,"2021, 2022, 2023, 2024",53.884,80.81,INVIABLE SANITARIAMENTE,EXISTENTE,2,14
132430,EL CAIRO,JUNTA ADMINISTRADORA LOCAL VEREDA NAPOLES,JUNTA ADMINISTRADORA LOCAL VEREDA NAPOLES,Rural,Norte Cartago,DISPERSA,Grifo,4.759461,-76.24503,9,"2021, 2022, 2023, 2024, 2025",66.12333333333333,91.73,INVIABLE SANITARIAMENTE,EXISTENTE,4,32
97365,EL CAIRO,JUNTA DE ACCION COMUNAL VEREDA ALTO BONITO,JUNTA DE ACCION COMUNAL VEREDA ALTO BONITO,Rural,Norte Cartago,DISPERSA,Grifo,4.804681,-76.18031,13,"2021, 2022, 2023, 2024, 2025, 2026",62.20230769230769,86.61,INVIABLE SANITARIAMENTE,EXISTENTE,3,41
34259,EL CERRITO,SOCIEDAD DE ACUEDUCTOS Y ALCANTARILLADOS DEL VALLE DEL CAUCA S.A. E.S.P. ACUAVALLE S.A. E.S.P. - EL CERRITO,ACUAVALLE S.A. E.S.P. - EL CERRITO,Urbano,Sur Cali,CABECERA MUNICIPAL,Grifo,3.677333,-76.36892,380,"2020, 2021, 2022, 2023, 2024, 2025, 2026",0.06594736842105264,17.96,MEDIO,EXISTENTE,2,3
36321,EL CERRITO,SOCIEDAD DE ACUEDUCTOS Y ALCANTARILLADOS DEL VALLE DEL CAUCA S.A. E.S.P. ACUAVALLE S.A. E.S.P. - EL CERRITO SANTA ELENA,ACUAVALLE S.A. E.S.P. - EL CERRITO - SANTA ELENA,Rural,Sur Cali,CENTRO POBLADO,Grifo,3.673222,-76.25706,49,"2020, 2021, 2022, 2023, 2024, 2025, 2026",0.06918367346938775,3.39,SIN RIESGO,EXISTENTE,1,1
151906,EL CERRITO,ACUEDUCTO AGUAS DEL CASTILLO,AGUAS DEL CASTILLO,Rural,Sur Cali,DISPERSA,Grifo,3.665444,-76.19239,1,2023,0.0,0.0,SIN RIESGO,EXISTENTE,0,0
33513,EL CERRITO,ACUASALUD AUJI,AUJI,Rural,Sur Cali,DISPERSA,Grifo,3.620778,-76.10819,19,"2020, 2021, 2022, 2023, 2024, 2025",20.080526315789474,76.92,ALTO,EXISTENTE,4,19
41579,EL CERRITO,LA ASOCIACION DE USUARIOS DEL ACUEDUCTO Y/O ALCANTARILLADO Y/O ASEO DE CAMPO ALEGRE - AUSERACA,CAMPO ALEGRE,Rural,Sur Cali,CENTRO POBLADO,Grifo,3.626806,-76.2525,27,"2020, 2021, 2022, 2023, 2024, 2025",4.580740740740741,35.46,ALTO,EXISTENTE,3,12
34209,EL CERRITO,ACUEDUCTO COMUNITARIO CARRIZAL,CARRIZAL,Rural,Sur Cali,DISPERSA,Grifo,3.657111,-76.08856,18,"2020, 2021, 2022, 2023, 2024, 2025, 2026",79.41777777777777,100.0,INVIABLE SANITARIAMENTE,EXISTENTE,7,89
37559,EL CERRITO,"LA ASOCIACION DE USUARIOS DEL ACUEDUCTO, ALCANTARILLADO Y/O ASEO DEL CRGT. EL POMO VEREDAS ROSARIO-BOLIVIA, EL CERRITO-VALLE",EL POMO,Rural,Sur Cali,CENTRO POBLADO,Grifo,3.638444,-76.18586,31,"2020, 2021, 2022, 2023, 2024, 2025, 2026",11.56516129032258,86.61,INVIABLE SANITARIAMENTE,EXISTENTE,5,19
152043,EL CERRITO,JUNTA DE ACCIÓN COMUNAL VEREDA REGADEROS,JUNTA DE ACCIÓN COMUNAL VEREDA REGADEROS,Rural,Sur Cali,DISPERSA,Filtro,3.639056,-76.10364,3,"2023, 2024",0.0,0.0,SIN RIESGO,EXISTENTE,0,0
39038,EL CERRITO,ACUEDUCTO EL MORAL,MORAL,Rural,Sur Cali,DISPERSA,Grifo,3.692861,-76.07344,19,"2020, 2021, 2022, 2023, 2024, 2025, 2026",0.0,0.0,SIN RIESGO,EXISTENTE,0,0
31395,EL CERRITO,ASOCIACION COMUNITARIA DE USUARIOS DE SERVICIOS PUBLICOS DOMICILIARIOS DEL CORREGIMIENTO DE EL PLACER MUNICIPIO DE EL CERRITO. AUSERPUB E.S.P.,PLANTA EL PLACER,Rural,Sur Cali,CENTRO POBLADO,Grifo,3.612889,-76.26542,64,"2020, 2021, 2022, 2023, 2024, 2025, 2026",0.280625,17.96,MEDIO,EXISTENTE,1,2
32189,EL CERRITO,ASOCIACION DE USUARIOS DEL SERVICIO DE AGUA POTABLE DE EL CASTILLO MUNICIPIO DE EL CERRITO. ASOSEAGUAS - RECAHON,RECAHON,Rural,Sur Cali,CENTRO POBLADO,Grifo,3.654694,-76.19625,27,"2020, 2021, 2022, 2023, 2024, 2025, 2026",7.195925925925927,80.81,INVIABLE SANITARIAMENTE,EXISTENTE,2,9
31842,EL CERRITO,ASOCIACION DE RECURSOS HIDRICOS NATURALES Y ACUEDUCTO DE LA VEREDA EL CASTILLO E.S.P. - RINAUCA E.S.P,RINAUCA,Rural,Sur Cali,CENTRO POBLADO,Grifo,3.665556,-76.19261,20,"2020, 2021, 2022, 2023, 2024, 2025, 2026",4.497,89.94,INVIABLE SANITARIAMENTE,EXISTENTE,5,6
37557,EL CERRITO,JUNTA ADMINISTRADORA DEL ACUEDUCTO ACUASALUD EL ROSARIO PARTE ALTA,ROSARIO PARTE ALTA,Rural,Sur Cali,DISPERSA,Grifo,3.627033,-76.19064,8,"2020, 2021, 2022, 2023",60.34625,88.19,INVIABLE SANITARIAMENTE,EXISTENTE,4,29
33508,EL CERRITO,JUNTA DE ACCION COMUNAL DE SANTA LUISA,SANTA LUISA,Rural,Sur Cali,CENTRO POBLADO,Grifo,3.622417,-76.08825,11,"2020, 2021, 2022, 2023, 2024",69.03272727272727,87.77,INVIABLE SANITARIAMENTE,EXISTENTE,5,43
33509,EL CERRITO,ASOCIACION DE USUARIOS DEL SERVICIO DE AGUA POTABLE Y ALCANTARILLADO DE TENERIFE - ASOUAT,TENERIFE,Rural,Sur Cali,CENTRO POBLADO,Grifo,3.729944,-76.07683,20,"2020, 2021, 2022, 2023, 2024, 2025, 2026",12.091,78.01,ALTO,EXISTENTE,3,12
69051,EL DOVIO,ASOCIACION DE USUARIOS DEL ACUEDUCTO RURAL COMUNITARIO DE LA VEREDA EL CRUCERO,ACUASERVICIO EL CRUCERO,Rural,Norte Cartago,DISPERSA,Grifo,4.521917,-76.22434,19,"2020, 2021, 2022, 2023, 2024, 2025, 2026",84.1757894736842,94.57,INVIABLE SANITARIAMENTE,EXISTENTE,5,98
69720,EL DOVIO,SOCIEDAD DE ACUEDUCTOS Y ALCANTARILLADOS DEL VALLE DEL CAUCA S.A. E.S.P. ACUAVALLE S.A. E.S.P. - EL DOVIO,ACUAVALLE S.A. E.S.P- EL DOVIO,Urbano,Norte Cartago,CABECERA MUNICIPAL,Grifo,4.500011,-76.22223,75,"2020, 2021, 2022, 2023, 2024, 2025, 2026",0.9041333333333333,24.85,MEDIO,EXISTENTE,4,13
68462,EL DOVIO,ASOCIACIÓN DE USUARIOS DEL ACUEDUCTO RURAL COMUNITARIO DE LA VEREDA LA CABAÑA AGUAS LA ESPERANZA,ACUEDUCTO AGUAS LA ESPERANZA - VDA LA CABAÑA,Rural,Norte Cartago,CENTRO POBLADO,Grifo,4.533589,-76.2,18,"2020, 2021, 2022, 2023, 2024, 2025, 2026",78.19666666666666,94.57,INVIABLE SANITARIAMENTE,EXISTENTE,5,82
69204,EL DOVIO,ACUEDUCTO COMUNITARIO AGUAS LA ALEJANDRÍA - LA HONDURA,ACUEDUCTO COMUNITARIO AGUAS LA ALEJANDRIA,Rural,Norte Cartago,DISPERSA,Grifo,4.543411,-76.28756,11,"2020, 2022, 2023, 2024, 2025, 2026",71.98363636363636,79.14,ALTO,EXISTENTE,4,50
117882,EL DOVIO,ACUEDUCTO RURAL BELLAVISTA,ACUEDUCTO RURAL BELLAVISTA TANQUE # 2,Rural,Norte Cartago,DISPERSA,Grifo / Filtro,4.517814,-76.17503,11,"2022, 2023, 2024, 2025",55.028181818181814,89.05,INVIABLE SANITARIAMENTE,EXISTENTE,5,40
117886,EL DOVIO,ACUEDUCTO RURAL BELLAVISTA,ACUEDUCTO RURAL BELLAVISTA TANQUE # 3,Rural,Norte Cartago,DISPERSA,Grifo / Filtro,4.517814,-76.17503,10,"2022, 2023, 2024, 2025",51.92,89.05,INVIABLE SANITARIAMENTE,EXISTENTE,4,35
117878,EL DOVIO,ACUEDUCTO RURAL BELLAVISTA,ACUEDUCTO RURAL BELLAVISTA- NO SE USA | ACUEDUCTO RURAL BELLAVISTA TANQUE # 1,Rural,Norte Cartago,DISPERSA,Grifo / Filtro,4.517814,-76.17503,17,"2020, 2021, 2022, 2023, 2024, 2025",53.67352941176471,94.12,INVIABLE SANITARIAMENTE,EXISTENTE,6,49
68494,EL DOVIO,ACUEDUCTO RURAL BIRMANIA,ACUEDUCTO RURAL BIRMANIA,Rural,Norte Cartago,DISPERSA,Grifo,4.498625,-76.37331,2,"2020, 2021",68.475,78.13,ALTO,EXISTENTE,3,5
113475,EL DOVIO,ACUEDUCTO RURAL CASTILLO CAÑADA HONDA ALTA,ACUEDUCTO RURAL CASTILLO CAÑADA HONDA ALTA,Rural,Norte Cartago,DISPERSA,Grifo,,,13,"2020, 2021, 2022, 2023, 2024, 2025",82.55076923076923,94.57,INVIABLE SANITARIAMENTE,EXISTENTE,5,68
122721,EL DOVIO,ACUEDUCTO RURAL CAÑADA HONDA BAJA-CASTILLO,ACUEDUCTO RURAL CAÑADA HONDA BAJA,Rural,Norte Cartago,DISPERSA,Grifo,4.511114,-76.19013,16,"2020, 2021, 2022, 2023, 2024, 2025",79.850625,94.57,INVIABLE SANITARIAMENTE,EXISTENTE,6,80
