CODIGO_SISTEMA,MUNICIPIO,PERSONA_PRESTADORA,SISTEMA_DISTRIBUCION,CLASIFICACION_URBANO_RURAL,ARO,TIPO_SISTEMA,TIPO_DISPOSITIVO_AJUSTADO,LATITUD,LONGITUD,MUESTRAS,ANIOS,IRCA_PROMEDIO,IRCA_MAXIMO,NIVEL_RIESGO,VALIDACION_SISTEMA,PARAMETROS_NO_ACEPTABLES,TOTAL_NO_ACEPTABLES
80697,ALCALA,SOCIEDAD DE ACUEDUCTOS Y ALCANTARILLADOS DEL VALLE DEL CAUCA S.A. E.S.P. ACUAVALLE S.A. E.S.P.-ALCALÁ,ACUAVALLE S.A. E.S.P- ALCALÁ,Urbano,Norte Cartago,CABECERA MUNICIPAL,Grifo,4.672503,-75.77195,147,"2020, 2021, 2022, 2023, 2024, 2025, 2026",1.4117687074829932,23.26,MEDIO,EXISTENTE,3,39
110201,ALCALA,ASOCIACION DE USUARIOS DEL ACUEDUCTO RURAL COMUNITARIO DE LA VEREDA EL EDEN,ACUEDUCTO EL EDEN,Rural,Norte Cartago,DISPERSA,Grifo,4.695786,-75.83319,16,"2020, 2021, 2022, 2023, 2024, 2025, 2026",57.069375,94.57,INVIABLE SANITARIAMENTE,EXISTENTE,6,69
115502,ALCALA,COOPERATIVA MARAVELEZ ALCALA ESP,COOPERATIVA MARAVELEZ ALCALA- SISTEMA #1,Rural,Norte Cartago,DISPERSA,Grifo,4.672931,-75.70801,23,"2020, 2021, 2022, 2023, 2024, 2025, 2026",33.146521739130435,80.81,INVIABLE SANITARIAMENTE,EXISTENTE,6,57
91940,ALCALA,COOPERATIVA MARAVELEZ ALCALA ESP,COOPERATIVA MARAVELEZ ALCALA- SISTEMA #2,Rural,Norte Cartago,CENTRO POBLADO,Grifo,4.666264,-75.72291,19,"2020, 2021, 2022, 2023, 2024, 2025, 2026",19.69736842105263,94.57,INVIABLE SANITARIAMENTE,EXISTENTE,6,25
115517,ALCALA,COOPERATIVA MARAVELEZ ALCALA ESP,COOPERATIVA MARAVELEZ ALCALA- SISTEMA #3,Rural,Norte Cartago,CENTRO POBLADO,Grifo,4.693836,-75.78505,15,"2020, 2021, 2022, 2023, 2024",24.062,88.0,INVIABLE SANITARIAMENTE,EXISTENTE,4,29
109043,ALCALA,COOPERATIVA MARAVELEZ ALCALA ESP,COOPERATIVA MARAVELEZ ALCALA- SISTEMA #4,Rural,Norte Cartago,DISPERSA,Grifo,4.659181,-75.73226,20,"2020, 2021, 2022, 2023, 2024, 2025, 2026",6.683,32.56,MEDIO,EXISTENTE,3,13
80803,ALCALA,COOPERATIVA MARAVELEZ ALCALA ESP,COOPERATIVA MARAVELEZ ALCALA- SISTEMA #5,Rural,Norte Cartago,DISPERSA,Grifo,4.687869,-75.81867,20,"2020, 2021, 2022, 2023, 2024, 2025, 2026",30.519,93.43,INVIABLE SANITARIAMENTE,EXISTENTE,7,55
111747,ALCALA,COOPERATIVA MARAVELEZ ALCALA ESP,COOPERATIVA MARAVELEZ ALCALA- SISTEMA #6,Rural,Norte Cartago,DISPERSA,Grifo,4.713136,-75.85354,18,"2020, 2021, 2022, 2023, 2024, 2025, 2026",24.287777777777777,86.52,INVIABLE SANITARIAMENTE,EXISTENTE,5,40
87903,ALCALA,COOPERATIVA MARAVELEZ ALCALA ESP,COOPERATIVA MARAVELEZ ALCALA- SISTEMA #7,Rural,Norte Cartago,DISPERSA,Grifo,4.656344,-75.71681,18,"2020, 2021, 2022, 2023, 2024, 2025, 2026",21.466666666666665,80.81,INVIABLE SANITARIAMENTE,EXISTENTE,6,36
110500,ALCALA,COOPERATIVA MARAVELEZ ALCALA ESP,COOPERATIVA MARAVELEZ ALCALA- SISTEMA #8,Rural,Norte Cartago,DISPERSA,Grifo,4.657989,-75.72749,17,"2020, 2021, 2022, 2023, 2024, 2025, 2026",34.42823529411765,89.93,INVIABLE SANITARIAMENTE,EXISTENTE,6,44
58650,ANDALUCIA,SOCIEDAD DE ACUEDUCTOS Y ALCANTARILLADOS DEL VALLE DEL CAUCA S.A. E.S.P. ACUAVALLE S.A. E.S.P. - ANDALUCIA,ACUAVALLE S.A. E.S.P. - ANDALUCIA,Urbano,Centro Tuluá,CABECERA MUNICIPAL,Grifo,4.176136,-76.17447,380,"2020, 2021, 2022, 2023, 2024, 2025, 2026",0.21684210526315792,22.39,MEDIO,EXISTENTE,5,11
62446,ANDALUCIA,ASOCIACION RURAL COMUNITARIA DE AGUA POTABLE Y SANEAMIENTO BASICO DEL CORREGIMIENTO DE ALTA FLOR - ASOACUAFLOR,ACUEDUCTO ALTA FLOR,Rural,Centro Tuluá,DISPERSA,Grifo,4.128169,-75.96815,9,"2020, 2021, 2023, 2024, 2025",66.36333333333333,89.05,INVIABLE SANITARIAMENTE,EXISTENTE,5,36
102222,ANDALUCIA,ACUEDUCTO RURAL EL PLACER,ACUEDUCTO EL PLACER,Rural,Centro Tuluá,DISPERSA,Grifo,4.100567,-76.08446,17,"2020, 2021, 2022, 2023, 2024, 2025, 2026",66.89823529411764,91.73,INVIABLE SANITARIAMENTE,EXISTENTE,6,78
150256,ANDALUCIA,INSTITUCION EDUCATIVA AGRICOLA CAMPOALEGRE SEDE SANTA MATILDE,ACUEDUCTO IE CAMPO ALEGRE SEDE SANTA MATILDE,Rural,Centro Tuluá,INSTITUCION EDUCATIVA,Grifo,4.138056,-75.97,1,2023,0.0,0.0,SIN RIESGO,EXISTENTE,0,0
62256,ANDALUCIA,ACUEDUCTO RURAL COMUNITARIO LA UNION CASCAJERO,ACUEDUCTO LA UNION CASCAJERO,Rural,Centro Tuluá,DISPERSA,Grifo / Filtro,4.156269,-75.96557,11,"2020, 2021, 2023, 2024, 2025",58.70363636363636,89.05,INVIABLE SANITARIAMENTE,EXISTENTE,5,41
64871,ANDALUCIA,ACUEDUCTO RURAL PARDO ALTO,ACUEDUCTO PARDO ALTO,Rural,Centro Tuluá,DISPERSA,Grifo,4.076389,-76.08386,13,"2020, 2021, 2022, 2023, 2024, 2025, 2026",65.87846153846155,92.44,INVIABLE SANITARIAMENTE,EXISTENTE,6,52
61992,ANDALUCIA,ACUEDUCTO RURAL POTRERILLO,ACUEDUCTO POTRERILLO,Rural,Centro Tuluá,DISPERSA,Grifo,4.105842,-76.09142,17,"2020, 2021, 2022, 2023, 2024, 2025, 2026",71.36823529411765,92.26,INVIABLE SANITARIAMENTE,EXISTENTE,5,80
127158,ANDALUCIA,MUNICIPIO DE ANDALUCIA PEÑON ALTO,MUNICIPIO DE ANDALUCIA PEÑON ALTO,Rural,Centro Tuluá,DISPERSA,Grifo / Filtro,4.178069,-76.14771,18,"2021, 2022, 2023, 2024, 2025, 2026",31.831111111111113,94.61,INVIABLE SANITARIAMENTE,EXISTENTE,7,38
86244,ANSERMANUEVO,SOCIEDAD DE ACUEDUCTOS Y ALCANTARILLADOS DEL VALLE DEL CAUCA S.A. E.S.P. ACUAVALLE S.A. E.S.P.-ANSERMANUEVO,ACUAVALLE S.A. E.S.P- ANSERMANUEVO,Urbano,Norte Cartago,CABECERA MUNICIPAL,Grifo,4.796672,-75.99252,151,"2020, 2021, 2022, 2023, 2024, 2025, 2026",0.9762251655629138,23.26,MEDIO,EXISTENTE,5,26
97410,ANSERMANUEVO,JUNTA DE ADMINISTRACION COMUAL LA ESPERANZA,ACUEDUCTO  LA  ESPERANZA | ACUEDUCTO LA ESPERANZA,Rural,Norte Cartago,DISPERSA,Grifo,4.831394,-76.10079,18,"2020, 2021, 2022, 2023, 2024, 2025, 2026",72.91444444444444,89.29,INVIABLE SANITARIAMENTE,EXISTENTE,6,75
126849,ANSERMANUEVO,ACUEDUCTO RURAL EL DIAMANTE,ACUEDUCTO EL DIAMANTE,Rural,Norte Cartago,DISPERSA,Grifo,4.789756,-76.0595,8,"2020, 2021, 2023, 2024, 2025",86.4125,94.57,INVIABLE SANITARIAMENTE,EXISTENTE,6,43
86924,ANSERMANUEVO,ASOCIACION DE USUARIOS DEL ACUEDUCTO EL VERGEL,ACUEDUCTO EL VERGEL,Rural,Norte Cartago,CENTRO POBLADO,Grifo,4.865075,-76.00722,13,"2020, 2021, 2022, 2023, 2024, 2025",11.186923076923078,63.58,ALTO,EXISTENTE,5,11
80699,ANSERMANUEVO,JUNTA ADMINISTRADORA ACUEDUCTO RURAL EL VILLAR,ACUEDUCTO EL VILLAR,Rural,Norte Cartago,CENTRO POBLADO,Grifo,4.819986,-76.09104,18,"2020, 2021, 2022, 2023, 2024, 2025, 2026",41.28666666666666,89.93,INVIABLE SANITARIAMENTE,EXISTENTE,6,51
80702,ANSERMANUEVO,ASOCIACION GESTORA COMUNITARIA DEL AGUA DEL CORREGIMIENTO LA CABAÑA,ACUEDUCTO LA CABAÑA,Rural,Norte Cartago,DISPERSA,Grifo,4.755024,-76.08022,21,"2020, 2021, 2022, 2023, 2024, 2025",58.76095238095238,94.57,INVIABLE SANITARIAMENTE,EXISTENTE,5,81
102412,ANSERMANUEVO,ASOCIACION GESTIÓN COMUNITARIA DE AGUA DE LA COMUNIDAD VEREDA LA DIVISA,ACUEDUCTO LA DIVISA,Rural,Norte Cartago,DISPERSA,Grifo,4.828097,-76.11026,17,"2020, 2021, 2022, 2023, 2024, 2025, 2026",74.38176470588235,93.98,INVIABLE SANITARIAMENTE,EXISTENTE,6,74
81281,ANSERMANUEVO,ACUEDUCTO COMUNITARIO LA HONDURA,ACUEDUCTO LA HONDURA,Rural,Norte Cartago,DISPERSA,Grifo,4.798836,-76.08668,17,"2020, 2021, 2022, 2023, 2024, 2025, 2026",57.01352941176471,94.96,INVIABLE SANITARIAMENTE,EXISTENTE,5,64
88266,ANSERMANUEVO,ASOCIACIÓN GESTIÓN COMUNITARIA DEL AGUA DE LA COMUNIDAD RURAL  LA POPALITA,ACUEDUCTO LA POPALITA,Rural,Norte Cartago,DISPERSA,Grifo,4.767839,-76.10246,19,"2020, 2021, 2022, 2023, 2024, 2025",82.07947368421053,91.73,INVIABLE SANITARIAMENTE,EXISTENTE,5,97
103903,ANSERMANUEVO,ACUEDUCTO VEREDA LAS PALOMAS-EL BOSQUE,ACUEDUCTO LAS PALOMAS EL BOSQUE,Rural,Norte Cartago,DISPERSA,Grifo,4.763733,-76.07967,13,"2020, 2021, 2022, 2023, 2024, 2025",69.52230769230769,87.77,INVIABLE SANITARIAMENTE,EXISTENTE,6,51
110255,ANSERMANUEVO,ASOCIACION GESTORA COMUNITARIA DEL AGUA DE LA COMUNIDAD RURAL REAL PLACER,ACUEDUCTO REAL PLACER,Rural,Norte Cartago,DISPERSA,Grifo / Filtro,4.786725,-76.07942,14,"2020, 2021, 2022, 2023, 2024, 2025",54.862142857142864,82.47,INVIABLE SANITARIAMENTE,EXISTENTE,4,44
110129,ANSERMANUEVO,ACUEDUCTO EL CASTILLO,ACUEDUCTO RURAL EL CASTILLO ALTO Y BAJO,Rural,Norte Cartago,DISPERSA,Grifo,4.779169,-76.1075,15,"2020, 2021, 2022, 2023, 2024, 2025",66.084,88.0,INVIABLE SANITARIAMENTE,EXISTENTE,6,56
81280,ANSERMANUEVO,ACUEDUCTO COMUNITARIO SALAZAR,ACUEDUCTO SALAZAR,Rural,Norte Cartago,CENTRO POBLADO,Grifo,4.789765,-76.00015,22,"2020, 2021, 2022, 2023, 2024, 2025",41.782272727272726,94.57,INVIABLE SANITARIAMENTE,EXISTENTE,6,68
81560,ANSERMANUEVO,ASOCIACIÓN DE USURIOS DEL ACUEDUCTO DEL ROBLE,ACUEDUCTOS DEL ROBLE SISTEMA #1 SAN AGUSTIN,Rural,Norte Cartago,DISPERSA,Grifo,4.846694,-76.13472,18,"2020, 2021, 2022, 2023, 2024, 2025",68.87333333333333,86.52,INVIABLE SANITARIAMENTE,EXISTENTE,6,71
87910,ANSERMANUEVO,JUNTA ADMON ACUEDUCTO EL TIGRE,JUNTA ACUEDUCTO EL TIGRE ALTO,Rural,Norte Cartago,DISPERSA,Grifo,4.780883,-76.12842,4,"2020, 2021, 2024",73.23,80.81,INVIABLE SANITARIAMENTE,EXISTENTE,5,17
143327,ANSERMANUEVO,JUNTA ADMON ACUEDUCTO EL TIGRE,JUNTA ACUEDUCTO EL TIGRE BAJO,Rural,Norte Cartago,DISPERSA,Grifo,4.779389,-76.13214,11,"2021, 2022, 2023, 2024, 2025",82.06636363636363,93.98,INVIABLE SANITARIAMENTE,EXISTENTE,5,59
60149,ANSERMANUEVO | CAICEDONIA,ASOCIACIÓN DE USURIOS DEL ACUEDUCTO DEL ROBLE | ASOCIACION DE USUARIOS CARARE,ACUEDUCTOS DEL ROBLE SISTEMA #2 EL ROBLE | ASOCIACION DE USUARIOS CARARE,Rural,Centro Tuluá,DISPERSA,Grifo,4.386403,-75.84199,20,"2020, 2021, 2022, 2023, 2024, 2025",63.0985,94.57,INVIABLE SANITARIAMENTE,EXISTENTE,6,70
86246,ARGELIA,SOCIEDAD DE ACUEDUCTOS Y ALCANTARILLADOS DEL VALLE DEL CAUCA S.A. E.S.P. ACUAVALLE S.A. E.S.P.-ARGELIA,ACUAVALLE S.A. E.S.P- ARGELIA,Urbano,Norte Cartago,CABECERA MUNICIPAL,Grifo,4.729889,-76.11389,74,"2020, 2021, 2022, 2023, 2024, 2025, 2026",0.04527027027027027,3.35,SIN RIESGO,EXISTENTE,1,1
81278,ARGELIA,JUNTA ADMINISTRADORA DEL ACUEDUCTO BARRIO VILLA NUBIA,ACUEDUCTO BARRIO VILLA NUBIA,Rural,Norte Cartago,DISPERSA,Grifo,4.725106,-76.12234,13,"2020, 2021, 2022, 2023, 2024, 2025",15.123846153846156,88.89,INVIABLE SANITARIAMENTE,EXISTENTE,6,18
80692,ARGELIA,ASOCIACION DE USUARIOS DEL ACUEDUCTO LA CRISTALINA,ACUEDUCTO LA CRISTALINA,Rural,Norte Cartago,DISPERSA,Grifo,4.657419,-76.13552,18,"2020, 2021, 2022, 2023, 2024, 2025, 2026",67.23944444444444,89.05,INVIABLE SANITARIAMENTE,EXISTENTE,5,75
81233,ARGELIA,ASOCIACION DE USUARIOS DEL ACUEDUCTO LA PALMA,ACUEDUCTO LA PALMA,Rural,Norte Cartago,DISPERSA,Grifo / Filtro,4.707275,-76.13666,21,"2020, 2021, 2022, 2023, 2024, 2025, 2026",68.96285714285715,94.57,INVIABLE SANITARIAMENTE,EXISTENTE,5,91
81231,ARGELIA,ASOCIACION DE USUARIOS DEL ACUEDUCTO RURAL COMUNITARIO DEL CORREGIMIENTO DE MARACAIBO,ACUEDUCTO MARACAIBO,Rural,Norte Cartago,DISPERSA,Grifo / Filtro,4.676778,-76.14687,17,"2020, 2021, 2022, 2023, 2024, 2025, 2026",60.744705882352946,100.0,INVIABLE SANITARIAMENTE,EXISTENTE,7,58
113566,ARGELIA,ACUEDUCTO RURAL RESGUARDO INDÍGENA DACHI BANÍA CHAMI,ACUEDUCTO RESGUARDO INDÍGENA BANÍA CHAMI,Rural,Norte Cartago,DISPERSA,Grifo,,,18,"2020, 2021, 2022, 2023, 2024, 2025, 2026",82.77944444444444,100.0,INVIABLE SANITARIAMENTE,EXISTENTE,5,91
11932,ARGELIA,ADMINISTRACION COOPERATIVA SAN ROQUE - LA SOLEDAD,COOPERATIVA SAN ROQUE LA SOLEDAD-LA PAZ-LA PRIMAVERA-TARRITOS-EL RÍO - SISTEMA # 1,Rural,Norte Cartago,CENTRO POBLADO,Grifo / Filtro,4.684519,-76.12979,16,"2020, 2021, 2022, 2023, 2024, 2025",79.940625,100.0,INVIABLE SANITARIAMENTE,EXISTENTE,6,77
91938,ARGELIA,ADMINISTRACION COOPERATIVA SAN ROQUE - LA SOLEDAD,COOPERATIVA SAN ROQUE LAS BRISAS RAIZAL LA AURORA -SISTEMA # 2,Rural,Norte Cartago,CENTRO POBLADO,Grifo,4.725194,-76.15353,13,"2020, 2021, 2022, 2023, 2024, 2025, 2026",15.463076923076922,69.01,ALTO,EXISTENTE,6,13
58651,BOLIVAR,SOCIEDAD DE ACUEDUCTOS Y ALCANTARILLADOS DEL VALLE DEL CAUCA S.A. E.S.P. ACUAVALLE S.A. E.S.P. - BOLIVAR,ACUAVALLE S.A. E.S.P. - BOLIVAR,Urbano,Centro Tuluá,CABECERA MUNICIPAL,Grifo,4.338628,-76.16724,75,"2020, 2021, 2022, 2023, 2024, 2025, 2026",0.42253333333333337,16.95,MEDIO,EXISTENTE,3,4
112140,BOLIVAR,ASOCIACION DE USUARIOS DEL ACUEDUCTO RURAL COMUNITARIO DE LAS VEREDAS AGUAS LINDAS Y BUENOS AIRES,ACUEDUCTO AGUAS LINDAS Y BUENOS AIRES,Rural,Centro Tuluá,CENTRO POBLADO,Grifo,4.411886,-76.32549,6,"2020, 2021, 2022, 2023",84.29833333333333,89.6,INVIABLE SANITARIAMENTE,EXISTENTE,7,41
125671,BOLIVAR,ACUEDUCTO RURAL CABAÑAS ALTA,ACUEDUCTO CABAÑAS ALTAS,Rural,Centro Tuluá,DISPERSA,Grifo,4.476075,-76.29456,4,"2021, 2022, 2023",73.06,82.71,INVIABLE SANITARIAMENTE,EXISTENTE,6,18
125674,BOLIVAR,ACUEDUCTO RURAL CABAÑAS BAJA,ACUEDUCTO CABAÑAS BAJA,Rural,Centro Tuluá,DISPERSA,Grifo,4.180136,-76.15889,4,"2020, 2021, 2022, 2023",64.1125,85.27,INVIABLE SANITARIAMENTE,EXISTENTE,4,16
60381,BOLIVAR,ASOCIACIÓN DE USUARIOS DE ABASTO DE AGUA DEL CORREGIMIENTO CERRO AZUL Y LAS VEREDAS LA SIRIA Y LA SOLEDAD,ACUEDUCTO CERRO AZUL,Rural,Centro Tuluá,CENTRO POBLADO,Grifo,4.279806,-76.28697,12,"2020, 2021, 2022, 2023, 2024, 2025",20.441666666666666,81.87,INVIABLE SANITARIAMENTE,EXISTENTE,7,26
122557,BOLIVAR,COMITE PRO ACUEDUCTO CRISTALES,ACUEDUCTO CRISTALES,Rural,Centro Tuluá,DISPERSA,Grifo,4.301117,-76.38045,6,"2020, 2021, 2022, 2023",44.56,82.84,INVIABLE SANITARIAMENTE,EXISTENTE,4,17
121705,BOLIVAR,ASOCIACIÓN DE USUARIOS DEL ACUEDUCTO DE BUENOS AIRES,ACUEDUCTO DE BUENOS AIRES,Rural,Centro Tuluá,DISPERSA,Grifo,4.396928,-76.25172,15,"2020, 2021, 2022, 2023, 2024, 2025",42.596,89.94,INVIABLE SANITARIAMENTE,EXISTENTE,6,48
58631,BOLIVAR,ASOCIACION DE USUARIOS DEL SERVICIO DE AGUA POTABLE Y ALCANTARILLADO DE PRIMAVERA,ACUEDUCTO DE PRIMAVERA ACUASALUD,Rural,Centro Tuluá,CENTRO POBLADO,Grifo,4.353333,-76.2639,23,"2020, 2021, 2022, 2023, 2024, 2025, 2026",6.769565217391304,23.26,MEDIO,EXISTENTE,3,17
111988,BOLIVAR,ASOCIACIÓN DE USUARIOS DEL ACUEDUCTO EL BOSQUE NO. 1,ACUEDUCTO EL BOSQUE NO. 1,Rural,Centro Tuluá,DISPERSA,Grifo,4.390028,-76.25185,11,"2020, 2021, 2022, 2023, 2024, 2025",57.49272727272727,92.4,INVIABLE SANITARIAMENTE,EXISTENTE,8,49
126660,BOLIVAR,ACUEDUCTO RURAL EL FUSIL,ACUEDUCTO EL FUSIL,Rural,Centro Tuluá,DISPERSA,Grifo,4.356667,-76.31556,9,"2020, 2021, 2022, 2023, 2024, 2025",76.58666666666666,89.94,INVIABLE SANITARIAMENTE,EXISTENTE,6,44
122556,BOLIVAR,ACUEDUCTO RURAL EL MATADERO DOS QUEBRADAS,ACUEDUCTO EL MATADERO DOS QUEBRADAS,Rural,Centro Tuluá,DISPERSA,Grifo,4.293503,-76.36311,5,"2020, 2021, 2022, 2023",75.268,87.6,INVIABLE SANITARIAMENTE,EXISTENTE,5,26
103476,BOLIVAR,ASOCIACION DE USUARIOS DEL ACUEDUCTO RURAL COMUNITARIO DE LA VEREDA EL ORO MUNICIPIO DE BOLIVAR VALLE DEL CAUCA,ACUEDUCTO EL ORO,Rural,Centro Tuluá,DISPERSA,Grifo,4.462044,-76.30953,4,"2020, 2021, 2022, 2023",81.865,89.6,INVIABLE SANITARIAMENTE,EXISTENTE,6,27
59619,BOLIVAR,ASOCIACIÓN DE USUARIOS DEL ACUEDUCTO DEL CORREGIMIENTO DE LA HERRADURA ASUAHER MUNICIPIO DE BOLIVAR VALLE DEL CAUCA,ACUEDUCTO LA HERRADURA,Rural,Centro Tuluá,CENTRO POBLADO,Grifo,4.275642,-76.21391,21,"2020, 2021, 2022, 2023, 2024, 2025, 2026",22.098095238095237,100.0,INVIABLE SANITARIAMENTE,EXISTENTE,9,49
64925,BOLIVAR,ASOCIACION DE USUARIOS ACUEDUCTO LA MARIA DEL CORREGIMIENTO LA TULIA DEL MUNICIPIO DE BOLIVAR - VALLE DEL CAUCA,ACUEDUCTO LA MARÍA,Rural,Centro Tuluá,DISPERSA,Grifo,4.378178,-76.25591,15,"2020, 2021, 2022, 2023, 2024, 2025",61.10733333333334,94.57,INVIABLE SANITARIAMENTE,EXISTENTE,6,67
103477,BOLIVAR,ASOCIACION DE SUSCRIPTORES DEL SERVICIO DE ACUEDUCTO RURAL COMUNITARIO MANANTIALES DE BETANIA,ACUEDUCTO MANANTIALES DE BETANIA,Rural,Centro Tuluá,CENTRO POBLADO,Grifo,4.439953,-76.30947,4,"2020, 2021, 2022, 2023",60.0275,87.86,INVIABLE SANITARIAMENTE,EXISTENTE,6,18
123647,BOLIVAR,ASOCIACION DE USUARIOS DEL ACUEDUCTO RURAL CAMPESINO VEREDA MORAVITO,ACUEDUCTO MORAVITO,Rural,Centro Tuluá,DISPERSA,Grifo,4.279269,-76.38605,5,"2020, 2021, 2022, 2023",75.13199999999999,85.27,INVIABLE SANITARIAMENTE,EXISTENTE,5,23
113587,BOLIVAR,ASOCIACION DE USUARIOS ACUEDUCTO NARANJAL,ACUEDUCTO NARANJAL,Rural,Centro Tuluá,CENTRO POBLADO,Grifo,4.356414,-76.35307,20,"2020, 2021, 2022, 2023, 2024, 2025",23.913,89.05,INVIABLE SANITARIAMENTE,EXISTENTE,5,42
62251,BOLIVAR,ASOCIACION DEL SERVICIO COMUNITARIO RURAL DEL AGUA DE LA VEREDA PUNTA LARGA MUNICIPIO DE BOLIVAR VALLE DEL CAUCA - AUSCRAP -,ACUEDUCTO PUNTA LARGA,Rural,Centro Tuluá,DISPERSA,Grifo,4.328061,-76.27541,16,"2020, 2021, 2022, 2023, 2024, 2025, 2026",35.615625,91.02,INVIABLE SANITARIAMENTE,EXISTENTE,5,42
113719,BOLIVAR,CORPORACION PARA EL DESARROLLO SOCIALAMBIENTAL TURISTICO CULTURAL ECONOMICO Y AGROPECUARIO DE SAN ISIDRO - CORPOSANISIDRO,ACUEDUCTO SAN ISIDRO,Rural,Centro Tuluá,DISPERSA,Grifo / Filtro,4.284747,-76.3064,14,"2020, 2021, 2022, 2023, 2024, 2025",10.250714285714285,48.6,ALTO,EXISTENTE,6,21
58630,BOLIVAR,ASOCIACION DE USUARIOS DEL SERVICIO COMUNITARIO RURAL DE AGUA Y ALCANTARILLADO LA MONTAÑUELA MUNICIPIO DE BOLIVAR - AUSCRAALMA,ACUEDUCTO Y ALCANTARILLADO MONTAÑUELA,Rural,Centro Tuluá,DISPERSA,Grifo,4.328333,-76.22583,14,"2020, 2021, 2022, 2023, 2024, 2025, 2026",42.29642857142857,94.57,INVIABLE SANITARIAMENTE,EXISTENTE,5,47
62095,BOLIVAR,ASOCIACIÓN DE USUARIOS DEL SERVICIO DE AGUA POTABLE Y ALCANTARILLADO DE RICAURTE VALLE - ASERCOM,ACUEDUCTO Y ALCANTARILLADO RICAURTE,Rural,Centro Tuluá,CENTRO POBLADO,Grifo,4.309453,-76.20946,25,"2020, 2021, 2022, 2023, 2024, 2025, 2026",1.0439999999999998,17.54,MEDIO,EXISTENTE,4,8
58632,BOLIVAR,ASOCIACIÓN DE USUARIOS DEL ACUEDUCTO RURAL COMUNITARIO DE LA VEREDA LA PLAZUELA,ASOCIACIÓN DE USUARIOS DEL ACUEDUCTO RURAL COMUNITARIO DE LA VEREDA LA PLAZUELA,Rural,Centro Tuluá,DISPERSA,Grifo,4.390367,-76.24296,16,"2020, 2021, 2022, 2023, 2024, 2025, 2026",72.833125,89.94,INVIABLE SANITARIAMENTE,EXISTENTE,6,77
65809,BOLIVAR,ASOCIACIÓN DE USUARIOS DEL ACUEDUCTO RURAL DE LAS VEREDAS EL BOSQUE LA ALDANA,ASOCIACIÓN DE USUARIOS DEL ACUEDUCTO RURAL DE LAS VEREDAS EL BOSQUE LA ALDANA,Rural,Centro Tuluá,DISPERSA,Grifo,4.359753,-76.24526,13,"2020, 2021, 2022, 2023, 2024, 2025, 2026",66.30384615384615,92.4,INVIABLE SANITARIAMENTE,EXISTENTE,7,64
61920,BOLIVAR,ASOCIACIÓN DE USUARIOS DEL ACUEDUCTO RURAL LA REFORMA LA AGUADA BOLIVAR,ASOCIACIÓN DE USUARIOS DEL ACUEDUCTO RURAL LA REFORMA LA AGUADA BOLIVAR,Rural,Centro Tuluá,DISPERSA,Grifo,4.379042,-76.22577,17,"2020, 2021, 2022, 2023, 2024, 2025, 2026",49.59176470588235,90.37,INVIABLE SANITARIAMENTE,EXISTENTE,6,61
60116,BOLIVAR,ASOCIACION DE USUARIOS DEL ACUEDUCTO LA TULIA,LA TULIA,Rural,Centro Tuluá,CENTRO POBLADO,Grifo,4.386394,-76.245,21,"2020, 2021, 2022, 2023, 2024, 2025, 2026",24.39428571428571,80.29,INVIABLE SANITARIAMENTE,EXISTENTE,6,38
117594,BOLIVAR,ASOCIACION DE USUARIOS DEL ACUEDUCTO LA TULIA,LA TULIA-EL PORVENIR,Rural,Centro Tuluá,DISPERSA,Grifo,4.391014,-76.24426,14,"2020, 2021, 2022, 2023, 2024, 2025, 2026",32.27214285714286,89.05,INVIABLE SANITARIAMENTE,EXISTENTE,6,38
58652,BUGALAGRANDE,SOCIEDAD DE ACUEDUCTOS Y ALCANTARILLADOS DEL VALLE DEL CAUCA S.A. E.S.P. ACUAVALLE S.A. E.S.P.-BUGALAGRANDE,ACUAVALLE S.A. E.S.P. - BUGALAGRANDE,Urbano,Centro Tuluá,CABECERA MUNICIPAL,Grifo,4.202783,-76.16029,151,"2020, 2021, 2022, 2023, 2024, 2025, 2026",0.13788079470198675,7.02,BAJO,EXISTENTE,2,3
113607,BUGALAGRANDE,ASOCIACION DE USUARIOS DEL ACUEDUCTO DE LA VEREDA SAN ISIDRO - ASUASANIS,ACUECUTO DE LA VEREDA SAN ISIDRO,Rural,Centro Tuluá,DISPERSA,Grifo / Filtro,4.114444,-76.01669,12,"2020, 2021, 2022, 2023, 2024, 2025, 2026",24.183333333333334,90.91,INVIABLE SANITARIAMENTE,EXISTENTE,5,17
120420,BUGALAGRANDE,ASOCIACION DE USUARIOS DEL ACUEDUCTO DE CAMPO ALEGRE DE CEYLAN,ACUEDUCTO CAMPO ALEGRE DE CEYLAN,Rural,Centro Tuluá,DISPERSA,Grifo,4.219431,-76.06784,6,"2020, 2021, 2022, 2023, 2024, 2025",31.235,64.33,ALTO,EXISTENTE,3,13
64193,BUGALAGRANDE,ASOCIACION DE USUARIOS DEL ACUEDUCTO DEL CORREGIMIENTO DE CHORRERAS MUNICIPIO DE BUGALAGRANDE - ASUACH,ACUEDUCTO CHORRERAS - ASUACH,Rural,Centro Tuluá,DISPERSA,Grifo,4.159742,-75.84171,6,"2020, 2022, 2023, 2024",28.05333333333333,88.65,INVIABLE SANITARIAMENTE,EXISTENTE,5,17
124821,BUGALAGRANDE,ACUEDUCTO CIELO ROTO,ACUEDUCTO CIELO ROTO,Rural,Centro Tuluá,DISPERSA,Grifo,,,4,"2020, 2021, 2023, 2024",67.045,89.47,INVIABLE SANITARIAMENTE,EXISTENTE,5,17
60312,BUGALAGRANDE,ASOCIACION DE USUARIOS DEL ACUEDUCTO Y ALCANTARILLADO EL GUAYABO,ACUEDUCTO EL GUAYABO,Rural,Centro Tuluá,DISPERSA,Grifo,4.244167,-76.18197,20,"2020, 2021, 2022, 2023, 2024, 2025, 2026",47.261,73.91,ALTO,EXISTENTE,12,96
58940,BUGALAGRANDE,ASOCIACION DE USUARIOS DEL SERVICIO DE AGUA POTABLE DEL ACUEDUCTO Y ALCANTARILLADO DE MESTIZAL,ACUEDUCTO EL MESTIZAL,Rural,Centro Tuluá,CENTRO POBLADO,Grifo,4.228908,-76.16225,21,"2020, 2021, 2022, 2023, 2024, 2025, 2026",18.21095238095238,57.36,ALTO,EXISTENTE,12,87
20353,BUGALAGRANDE,ACUEDUCTO LA BETULIA,ACUEDUCTO LA BETULIA,Rural,Centro Tuluá,DISPERSA,Grifo / Filtro,,,4,"2024, 2025, 2026",74.2125,94.57,INVIABLE SANITARIAMENTE,VALIDAR SISTEMA,5,18
58633,BUGALAGRANDE,ASOCIACION DE USUARIOS DEL ACUEDUCTO DE PAILA ARRIBA,ACUEDUCTO PAILA ARRIBA,Rural,Centro Tuluá,CENTRO POBLADO,Grifo,4.236411,-76.03446,18,"2020, 2021, 2022, 2023, 2024, 2025, 2026",54.550555555555555,100.0,INVIABLE SANITARIAMENTE,EXISTENTE,10,75
113605,BUGALAGRANDE,ACUEDUCTO RURAL EL PLACER,ACUEDUCTO RURAL EL PLACER,Rural,Centro Tuluá,DISPERSA,Grifo,,,4,"2021, 2022, 2023",86.9725,92.36,INVIABLE SANITARIAMENTE,EXISTENTE,6,31
113736,BUGALAGRANDE,ACUEDUCTO RURAL LA ESMERALDA ALTA,ACUEDUCTO RURAL LA ESMERALDA ALTA,Rural,Centro Tuluá,DISPERSA,Grifo,4.100292,-76.06664,4,"2020, 2022, 2023, 2024",69.925,86.52,INVIABLE SANITARIAMENTE,EXISTENTE,5,18
60313,BUGALAGRANDE,ASOCIACION DE USUARIOS DEL SERVICIO DE AGUA POTABLE Y ALCANTARILLADO DE SAN ANTONIO,ACUEDUCTO SAN ANTONIO,Rural,Centro Tuluá,DISPERSA,Grifo,4.228894,-76.21528,18,"2020, 2021, 2022, 2023, 2024, 2025, 2026",18.733888888888888,40.24,ALTO,EXISTENTE,8,65
103052,BUGALAGRANDE,ASOCIACION DE USUARIOS ASODIS ALTO BONITO,ASOCIACION DE USUARIOS ASODIS ALTO BONITO,Rural,Centro Tuluá,DISPERSA,Grifo,4.112361,-76.00314,8,"2020, 2022, 2023, 2024, 2025, 2026",51.3775,82.84,INVIABLE SANITARIAMENTE,EXISTENTE,4,24
112154,BUGALAGRANDE,ASOCIACION DE USUARIOS DE ALMENDRONAL,ASOCIACION DE USUARIOS DE ALMENDRONAL,Rural,Centro Tuluá,DISPERSA,Grifo,4.149033,-76.06788,3,"2021, 2023, 2024",88.46666666666665,88.98,INVIABLE SANITARIAMENTE,EXISTENTE,6,20
60151,BUGALAGRANDE,ASOCIACION DE USUARIOS DE LOS SERVICIOS PUBLICOS DEL CORREGIMIENTO DE CEILAN MUNICIPIO DE BUGALAGRANDE DEPARTAMENTO DEL VALLE DEL CAUCA,ASOCIACION DE USUARIOS DE LOS SERVICIOS PUBLICOS DEL CORREGIMIENTO DE CEILAN,Rural,Centro Tuluá,CENTRO POBLADO,Grifo,4.108833,-76.04056,34,"2020, 2021, 2022, 2023, 2024, 2025, 2026",4.853823529411764,57.14,ALTO,EXISTENTE,4,17
104096,BUGALAGRANDE,ASOCIACION DE USUARIOS DEL ACUEDUCTO LA COLONIA,ASOCIACION DE USUARIOS DEL ACUEDUCTO LA COLONIA,Rural,Centro Tuluá,DISPERSA,Grifo / Filtro,4.146503,-76.0218,8,"2020, 2021, 2022, 2023, 2024, 2025, 2026",56.95625,93.39,INVIABLE SANITARIAMENTE,EXISTENTE,6,32
60314,BUGALAGRANDE,ASOCIACIÓN AGUAS DE GALICIA,ASOCIACIÓN AGUAS DE GALICIA,Rural,Centro Tuluá,CENTRO POBLADO,Grifo,4.172831,-76.05827,13,"2020, 2021, 2022, 2023, 2024, 2025, 2026",53.26692307692308,94.57,INVIABLE SANITARIAMENTE,EXISTENTE,6,54
112155,BUGALAGRANDE,ASOCIACIÓN DE USUARIOS DEL ACUEDUCTO RURAL COMUNITARIO DE LAS VEREDAS CHICORAL Y EL PORVENIR - ASUACHIJAPOR -,ASUACHIJAPOR - CHICORAL ALTO,Rural,Centro Tuluá,DISPERSA,Grifo / Filtro,0,-76.05262,7,"2021, 2022, 2023, 2024, 2025",49.534285714285716,94.57,INVIABLE SANITARIAMENTE,EXISTENTE,5,22
124820,BUGALAGRANDE,ASOCIACIÓN DE USUARIOS DEL ACUEDUCTO RURAL COMUNITARIO DE LAS VEREDAS CHICORAL Y EL PORVENIR - ASUACHIJAPOR -,ASUACHIJAPOR - CHICORAL BAJO,Rural,Centro Tuluá,DISPERSA,Filtro,4.158742,-76.03342,7,"2021, 2023, 2024, 2025",40.77428571428572,92.93,INVIABLE SANITARIAMENTE,EXISTENTE,6,21
124819,BUGALAGRANDE,ASOCIACIÓN DE USUARIOS DEL ACUEDUCTO RURAL COMUNITARIO DE LAS VEREDAS CHICORAL Y EL PORVENIR - ASUACHIJAPOR -,ASUACHIJAPOR - EL JARDIN,Rural,Centro Tuluá,DISPERSA,Filtro / Grifo,4.158742,-76.03342,5,"2022, 2023, 2024, 2025",52.294000000000004,94.57,INVIABLE SANITARIAMENTE,EXISTENTE,5,18
124804,BUGALAGRANDE,ASOCIACIÓN DE USUARIOS DEL ACUEDUCTO RURAL COMUNITARIO DE LAS VEREDAS CHICORAL Y EL PORVENIR - ASUACHIJAPOR -,ASUACHIJAPOR - EL PORVENIR,Rural,Centro Tuluá,DISPERSA,Grifo / Filtro,4.151117,-76.02729,8,"2020, 2021, 2022, 2023, 2024, 2025",73.775,94.57,INVIABLE SANITARIAMENTE,EXISTENTE,5,38
999993,BUGALAGRANDE,EDS DISTRACOM,EDS DISTRACOM,Rural,Centro Tuluá,PRIVADO,Grifo,,,1,2021,90.23,90.23,INVIABLE SANITARIAMENTE,VALIDAR SISTEMA,6,7
113738,BUGALAGRANDE,JUANTA ADMINISTRADORA DEL ACUEDUCTO DE LA VEREDA LA ESMERALDA BAJA,EL TIGRE,Rural,Centro Tuluá,DISPERSA,Grifo,,,6,"2021, 2022, 2023, 2024, 2025",61.69166666666666,86.61,INVIABLE SANITARIAMENTE,VALIDAR SISTEMA,5,23
61922,BUGALAGRANDE,JUNTA ADMINISTRADORA DEL ACUEDUCTO LA MORENA,JUNTA ADMINISTRADORA DEL ACUEDUCTO LA MORENA,Rural,Centro Tuluá,DISPERSA,Grifo,4.135678,-76.07157,3,"2022, 2023, 2024",72.60000000000001,86.52,INVIABLE SANITARIAMENTE,EXISTENTE,5,14
999991,BUGALAGRANDE,JUNTA DE ACCION COMUNAL LA BALBORA,JUNTA DE ACCION COMUNAL LA BALBORA,Rural,Centro Tuluá,DISPERSA,Grifo,,,1,2026,69.17,69.17,ALTO,VALIDAR SISTEMA,3,4
119303,BUGALAGRANDE,ASOCIACION DE USUARIOS DEL ACUEDUCTO RURAL DE LA VEREDA TETILLAL ALTO,TETILLAL ALTO,Rural,Centro Tuluá,DISPERSA,Grifo,,,4,"2021, 2022, 2023, 2024",78.045,86.52,INVIABLE SANITARIAMENTE,VALIDAR SISTEMA,5,19
61921,BUGALAGRANDE,ASOCIACION DE USUARIOS DEL ACUEDUCTO RURAL DE LA VEREDA TETILLAL BAJO,TETILLAL BAJO,Rural,Centro Tuluá,DISPERSA,Grifo,4.157958,-76.05406,4,"2021, 2022, 2023, 2024",81.5975,85.27,INVIABLE SANITARIAMENTE,EXISTENTE,4,20
58653,CAICEDONIA,SOCIEDAD DE ACUEDUCTOS Y ALCANTARILLADOS DEL VALLE DEL CAUCA S.A. E.S.P. ACUAVALLE S.A. E.S.P.-CAICEDONIA,ACUAVALLE S.A. E.S.P. - CAICEDONIA,Urbano,Centro Tuluá,CABECERA MUNICIPAL,Grifo,4.335019,-75.82139,379,"2020, 2021, 2022, 2023, 2024, 2025, 2026",0.025092348284960427,7.19,BAJO,EXISTENTE,2,3
